{
  "schema_version": "lathe.scene_patch.v1",
  "patch_id": "patch_alchemist_observatory_example_001",
  "scope": "object",
  "target_id": "obj_astrolabe_table_001",
  "instruction": "Add a small deterministic proxy-safe emphasis pass while preserving stable IDs, layout, position, scale, and branch continuity.",
  "preserve": [
    "object_id",
    "region",
    "transform.position",
    "transform.rotation",
    "transform.scale"
  ],
  "allowed_changes": [
    "style",
    "metadata"
  ],
  "continuity": {
    "mode": "preserve_selected_ids",
    "preserved_ids": [
      "obj_astrolabe_table_001"
    ]
  },
  "acceptance": {
    "validators": [
      "style",
      "semantic",
      "composition",
      "continuity"
    ],
    "minimum_score": 0.78
  }
}
